[{"id":"4401001","title":"Lab safety reminder","last_reply_at":"2026-09-24T12:00:00Z","created_at":"2026-09-24T12:00:00Z","delayed_post_at":null,"posted_at":"2026-09-24T12:00:00Z","assignment_id":null,"root_topic_id":null,"position":null,"podcast_has_student_posts":false,"discussion_type":"side_comment","lock_at":null,"allow_rating":false,"only_graders_can_rate":false,"sort_by_rating":false,"is_section_specific":false,"anonymous_state":null,"summary_enabled":false,"user_name":"Devon Marsh","discussion_subentry_count":0,"permissions":{"attach":false,"update":false,"reply":false,"delete":false,"manage_assign_to":false},"require_initial_post":null,"user_can_see_posts":true,"podcast_url":null,"read_state":"unread","unread_count":0,"subscribed":false,"attachments":[],"published":true,"can_unpublish":false,"locked":true,"can_lock":false,"comments_disabled":true,"author":{"id":"520331","anonymous_id":"b5hn","display_name":"Devon Marsh","avatar_image_url":"https://northgate.instructure.example/images/messages/avatar-50.png","html_url":"https://northgate.instructure.example/courses/90412/users/520331","pronouns":null},"html_url":"https://northgate.instructure.example/courses/90412/discussion_topics/4401001","url":"https://northgate.instructure.example/courses/90412/discussion_topics/4401001","pinned":false,"group_category_id":null,"can_group":true,"topic_children":[],"group_topic_children":[],"context_code":"course_90412","ungraded_discussion_overrides":[],"locked_for_user":false,"message":"\u003cp\u003eGoggles on for every lab, including virtual demos.\u003c/p\u003e","subscription_hold":"topic_is_announcement","todo_date":null,"is_announcement":true,"sort_order":"desc","sort_order_locked":false,"expanded":false,"expanded_locked":false},{"id":"4401000","title":"Unit 2 Test moved to Oct 9","last_reply_at":"2026-09-21T12:00:00Z","created_at":"2026-09-21T12:00:00Z","delayed_post_at":null,"posted_at":"2026-09-21T12:00:00Z","assignment_id":null,"root_topic_id":null,"position":null,"podcast_has_student_posts":false,"discussion_type":"side_comment","lock_at":null,"allow_rating":false,"only_graders_can_rate":false,"sort_by_rating":false,"is_section_specific":false,"anonymous_state":null,"summary_enabled":false,"user_name":"Sasha Brightwater","discussion_subentry_count":0,"permissions":{"attach":false,"update":false,"reply":false,"delete":false,"manage_assign_to":false},"require_initial_post":null,"user_can_see_posts":true,"podcast_url":null,"read_state":"read","unread_count":0,"subscribed":false,"attachments":[],"published":true,"can_unpublish":false,"locked":true,"can_lock":false,"comments_disabled":true,"author":{"id":"520330","anonymous_id":"b5hm","display_name":"Sasha Brightwater","avatar_image_url":"https://northgate.instructure.example/images/messages/avatar-50.png","html_url":"https://northgate.instructure.example/courses/90411/users/520330","pronouns":null},"html_url":"https://northgate.instructure.example/courses/90411/discussion_topics/4401000","url":"https://northgate.instructure.example/courses/90411/discussion_topics/4401000","pinned":false,"group_category_id":null,"can_group":true,"topic_children":[],"group_topic_children":[],"context_code":"course_90411","ungraded_discussion_overrides":[],"locked_for_user":false,"message":"\u003cp\u003eThe Unit 2 Test is Friday Oct 9.\u003c/p\u003e","subscription_hold":"topic_is_announcement","todo_date":null,"is_announcement":true,"sort_order":"desc","sort_order_locked":false,"expanded":false,"expanded_locked":false}]