[{"id":"3301002","title":"Speech order posted","last_reply_at":"2026-09-28T01:00:00Z","created_at":"2026-09-28T01:00:00Z","delayed_post_at":null,"posted_at":"2026-09-28T01:00:00Z","assignment_id":null,"root_topic_id":null,"position":null,"podcast_has_student_posts":false,"discussion_type":"side_comment","lock_at":null,"allow_rating":false,"only_graders_can_rate":false,"sort_by_rating":false,"is_section_specific":false,"anonymous_state":null,"summary_enabled":false,"user_name":"Kai Larkspur","discussion_subentry_count":0,"permissions":{"attach":false,"update":false,"reply":false,"delete":false,"manage_assign_to":false},"require_initial_post":null,"user_can_see_posts":true,"podcast_url":null,"read_state":"unread","unread_count":0,"subscribed":false,"attachments":[],"published":true,"can_unpublish":false,"locked":true,"can_lock":false,"comments_disabled":true,"author":{"id":"410223","anonymous_id":"8sj3","display_name":"Kai Larkspur","avatar_image_url":"https://harborcity.instructure.example/images/messages/avatar-50.png","html_url":"https://harborcity.instructure.example/courses/70314/users/410223","pronouns":null},"html_url":"https://harborcity.instructure.example/courses/70314/discussion_topics/3301002","url":"https://harborcity.instructure.example/courses/70314/discussion_topics/3301002","pinned":false,"group_category_id":null,"can_group":true,"topic_children":[],"group_topic_children":[],"context_code":"course_70314","ungraded_discussion_overrides":[],"locked_for_user":false,"message":"\u003cp\u003eSpeaking order for Thursday is posted in Files.\u003c/p\u003e","subscription_hold":"topic_is_announcement","todo_date":null,"is_announcement":true,"sort_order":"desc","sort_order_locked":false,"expanded":false,"expanded_locked":false},{"id":"3301003","title":"Final exam: bring a calculator","last_reply_at":"2026-09-27T16:00:00Z","created_at":"2026-09-27T16:00:00Z","delayed_post_at":null,"posted_at":"2026-09-27T16:00:00Z","assignment_id":null,"root_topic_id":null,"position":null,"podcast_has_student_posts":false,"discussion_type":"side_comment","lock_at":null,"allow_rating":false,"only_graders_can_rate":false,"sort_by_rating":false,"is_section_specific":false,"anonymous_state":null,"summary_enabled":false,"user_name":"Avery Cloudmere","discussion_subentry_count":0,"permissions":{"attach":false,"update":false,"reply":false,"delete":false,"manage_assign_to":false},"require_initial_post":null,"user_can_see_posts":true,"podcast_url":null,"read_state":"unread","unread_count":0,"subscribed":false,"attachments":[],"published":true,"can_unpublish":false,"locked":true,"can_lock":false,"comments_disabled":true,"author":{"id":"410220","anonymous_id":"8sj0","display_name":"Avery Cloudmere","avatar_image_url":"https://harborcity.instructure.example/images/messages/avatar-50.png","html_url":"https://harborcity.instructure.example/courses/70311/users/410220","pronouns":null},"html_url":"https://harborcity.instructure.example/courses/70311/discussion_topics/3301003","url":"https://harborcity.instructure.example/courses/70311/discussion_topics/3301003","pinned":false,"group_category_id":null,"can_group":true,"topic_children":[],"group_topic_children":[],"context_code":"course_70311","ungraded_discussion_overrides":[],"locked_for_user":false,"message":"\u003cp\u003eNon-programmable calculators only.\u003c/p\u003e","subscription_hold":"topic_is_announcement","todo_date":null,"is_announcement":true,"sort_order":"desc","sort_order_locked":false,"expanded":false,"expanded_locked":false},{"id":"3301000","title":"Final exam room change","last_reply_at":"2026-09-26T19:00:00Z","created_at":"2026-09-26T19:00:00Z","delayed_post_at":null,"posted_at":"2026-09-26T19:00:00Z","assignment_id":null,"root_topic_id":null,"position":null,"podcast_has_student_posts":false,"discussion_type":"side_comment","lock_at":null,"allow_rating":false,"only_graders_can_rate":false,"sort_by_rating":false,"is_section_specific":false,"anonymous_state":null,"summary_enabled":false,"user_name":"Rowan Tidewell","discussion_subentry_count":0,"permissions":{"attach":false,"update":false,"reply":false,"delete":false,"manage_assign_to":false},"require_initial_post":null,"user_can_see_posts":true,"podcast_url":null,"read_state":"read","unread_count":0,"subscribed":false,"attachments":[],"published":true,"can_unpublish":false,"locked":true,"can_lock":false,"comments_disabled":true,"author":{"id":"410221","anonymous_id":"8sj1","display_name":"Rowan Tidewell","avatar_image_url":"https://harborcity.instructure.example/images/messages/avatar-50.png","html_url":"https://harborcity.instructure.example/courses/70312/users/410221","pronouns":null},"html_url":"https://harborcity.instructure.example/courses/70312/discussion_topics/3301000","url":"https://harborcity.instructure.example/courses/70312/discussion_topics/3301000","pinned":false,"group_category_id":null,"can_group":true,"topic_children":[],"group_topic_children":[],"context_code":"course_70312","ungraded_discussion_overrides":[],"locked_for_user":false,"message":"\u003cp\u003eThe final is now in \u003cstrong\u003eScience 301\u003c/strong\u003e.\u003c/p\u003e","subscription_hold":"topic_is_announcement","todo_date":null,"is_announcement":true,"sort_order":"desc","sort_order_locked":false,"expanded":false,"expanded_locked":false},{"id":"3301001","title":"Final project rubric","last_reply_at":"2026-09-24T16:00:00Z","created_at":"2026-09-24T16:00:00Z","delayed_post_at":null,"posted_at":"2026-09-24T16:00:00Z","assignment_id":null,"root_topic_id":null,"position":null,"podcast_has_student_posts":false,"discussion_type":"side_comment","lock_at":null,"allow_rating":false,"only_graders_can_rate":false,"sort_by_rating":false,"is_section_specific":false,"anonymous_state":null,"summary_enabled":false,"user_name":"Emerson Vale","discussion_subentry_count":0,"permissions":{"attach":false,"update":false,"reply":false,"delete":false,"manage_assign_to":false},"require_initial_post":null,"user_can_see_posts":true,"podcast_url":null,"read_state":"read","unread_count":0,"subscribed":false,"attachments":[],"published":true,"can_unpublish":false,"locked":true,"can_lock":false,"comments_disabled":true,"author":{"id":"410222","anonymous_id":"8sj2","display_name":"Emerson Vale","avatar_image_url":"https://harborcity.instructure.example/images/messages/avatar-50.png","html_url":"https://harborcity.instructure.example/courses/70313/users/410222","pronouns":null},"html_url":"https://harborcity.instructure.example/courses/70313/discussion_topics/3301001","url":"https://harborcity.instructure.example/courses/70313/discussion_topics/3301001","pinned":false,"group_category_id":null,"can_group":true,"topic_children":[],"group_topic_children":[],"context_code":"course_70313","ungraded_discussion_overrides":[],"locked_for_user":false,"message":"\u003cp\u003eThe rubric for the final project is posted.\u003c/p\u003e","subscription_hold":"topic_is_announcement","todo_date":null,"is_announcement":true,"sort_order":"desc","sort_order_locked":false,"expanded":false,"expanded_locked":false}]