[{"id":"5501000","title":"Progress reports","last_reply_at":"2026-09-18T13:45:00Z","created_at":"2026-09-18T13:45:00Z","delayed_post_at":null,"posted_at":"2026-09-18T13:45:00Z","assignment_id":null,"root_topic_id":null,"position":null,"podcast_has_student_posts":false,"discussion_type":"side_comment","lock_at":null,"allow_rating":false,"only_graders_can_rate":false,"sort_by_rating":false,"is_section_specific":false,"anonymous_state":null,"summary_enabled":false,"user_name":"Drew Hallorann","discussion_subentry_count":0,"permissions":{"attach":false,"update":false,"reply":false,"delete":false,"manage_assign_to":false},"require_initial_post":null,"user_can_see_posts":true,"podcast_url":null,"read_state":"read","unread_count":0,"subscribed":false,"attachments":[],"published":true,"can_unpublish":false,"locked":true,"can_lock":false,"comments_disabled":true,"author":{"id":"640100","anonymous_id":"dpwk","display_name":"Drew Hallorann","avatar_image_url":"https://riverbend.instructure.example/images/messages/avatar-50.png","html_url":"https://riverbend.instructure.example/courses/77301/users/640100","pronouns":null},"html_url":"https://riverbend.instructure.example/courses/77301/discussion_topics/5501000","url":"https://riverbend.instructure.example/courses/77301/discussion_topics/5501000","pinned":false,"group_category_id":null,"can_group":true,"topic_children":[],"group_topic_children":[],"context_code":"course_77301","ungraded_discussion_overrides":[],"locked_for_user":false,"message":"\u003cp\u003eYour grades for this class are in the district grade portal.\u003c/p\u003e","subscription_hold":"topic_is_announcement","todo_date":null,"is_announcement":true,"sort_order":"desc","sort_order_locked":false,"expanded":false,"expanded_locked":false}]