[{"id":"2551002","title":"Exam 1 scores posted","last_reply_at":"2026-09-25T21:00:00Z","created_at":"2026-09-25T21:00:00Z","delayed_post_at":null,"posted_at":"2026-09-25T21:00:00Z","assignment_id":null,"root_topic_id":null,"position":null,"podcast_has_student_posts":false,"discussion_type":"side_comment","lock_at":null,"allow_rating":false,"only_graders_can_rate":false,"sort_by_rating":false,"is_section_specific":false,"anonymous_state":null,"summary_enabled":false,"user_name":"Morgan Fernhill","discussion_subentry_count":0,"permissions":{"attach":false,"update":false,"reply":false,"delete":false,"manage_assign_to":false},"require_initial_post":null,"user_can_see_posts":true,"podcast_url":null,"read_state":"read","unread_count":0,"subscribed":false,"attachments":[],"published":true,"can_unpublish":false,"locked":true,"can_lock":false,"comments_disabled":true,"author":{"id":"300111","anonymous_id":"6fkf","display_name":"Morgan Fernhill","avatar_image_url":"https://canvas.northfield.example/images/messages/avatar-50.png","html_url":"https://canvas.northfield.example/courses/51843/users/300111","pronouns":"she/her"},"html_url":"https://canvas.northfield.example/courses/51843/discussion_topics/2551002","url":"https://canvas.northfield.example/courses/51843/discussion_topics/2551002","pinned":false,"group_category_id":null,"can_group":true,"topic_children":[],"group_topic_children":[],"context_code":"course_51843","ungraded_discussion_overrides":[],"locked_for_user":false,"message":"\u003cp\u003eExam 1 scores are posted. The class average was 78%.\u003c/p\u003e","subscription_hold":"topic_is_announcement","todo_date":null,"is_announcement":true,"sort_order":"desc","sort_order_locked":false,"expanded":false,"expanded_locked":false},{"id":"2551003","title":"Midterm 2 review session Thursday","last_reply_at":"2026-09-25T20:10:00Z","created_at":"2026-09-25T20:10:00Z","delayed_post_at":null,"posted_at":"2026-09-25T20:10:00Z","assignment_id":null,"root_topic_id":null,"position":null,"podcast_has_student_posts":false,"discussion_type":"side_comment","lock_at":null,"allow_rating":false,"only_graders_can_rate":false,"sort_by_rating":false,"is_section_specific":false,"anonymous_state":null,"summary_enabled":false,"user_name":"Casey Linden","discussion_subentry_count":0,"permissions":{"attach":false,"update":false,"reply":false,"delete":false,"manage_assign_to":false},"require_initial_post":null,"user_can_see_posts":true,"podcast_url":null,"read_state":"read","unread_count":0,"subscribed":false,"attachments":[],"published":true,"can_unpublish":false,"locked":true,"can_lock":false,"comments_disabled":true,"author":{"id":"300110","anonymous_id":"6fke","display_name":"Casey Linden","avatar_image_url":"https://canvas.northfield.example/images/messages/avatar-50.png","html_url":"https://canvas.northfield.example/courses/51842/users/300110","pronouns":null},"html_url":"https://canvas.northfield.example/courses/51842/discussion_topics/2551003","url":"https://canvas.northfield.example/courses/51842/discussion_topics/2551003","pinned":false,"group_category_id":null,"can_group":true,"topic_children":[],"group_topic_children":[],"context_code":"course_51842","ungraded_discussion_overrides":[],"locked_for_user":false,"message":"\u003cp\u003eReview session Thursday Oct 1, 5:00-6:30 pm in Sage Hall 118.\u003c/p\u003e","subscription_hold":"topic_is_announcement","todo_date":null,"is_announcement":true,"sort_order":"desc","sort_order_locked":false,"expanded":false,"expanded_locked":false},{"id":"2551001","title":"Writing Center drop-in hours","last_reply_at":"2026-09-21T15:00:00Z","created_at":"2026-09-21T15:00:00Z","delayed_post_at":null,"posted_at":"2026-09-21T15:00:00Z","assignment_id":null,"root_topic_id":null,"position":null,"podcast_has_student_posts":false,"discussion_type":"side_comment","lock_at":null,"allow_rating":false,"only_graders_can_rate":false,"sort_by_rating":false,"is_section_specific":false,"anonymous_state":null,"summary_enabled":false,"user_name":"Jamie Quarry","discussion_subentry_count":0,"permissions":{"attach":false,"update":false,"reply":false,"delete":false,"manage_assign_to":false},"require_initial_post":null,"user_can_see_posts":true,"podcast_url":null,"read_state":"read","unread_count":0,"subscribed":false,"attachments":[],"published":true,"can_unpublish":false,"locked":true,"can_lock":false,"comments_disabled":true,"author":{"id":"300114","anonymous_id":"6fki","display_name":"Jamie Quarry","avatar_image_url":"https://canvas.northfield.example/images/messages/avatar-50.png","html_url":"https://canvas.northfield.example/courses/51847/users/300114","pronouns":null},"html_url":"https://canvas.northfield.example/courses/51847/discussion_topics/2551001","url":"https://canvas.northfield.example/courses/51847/discussion_topics/2551001","pinned":false,"group_category_id":null,"can_group":true,"topic_children":[],"group_topic_children":[],"context_code":"course_51847","ungraded_discussion_overrides":[],"locked_for_user":false,"message":"\u003cp\u003eThe Writing Center is open for drop-ins Mon-Thu 2-6 pm in Liberal Arts 110.\u003c/p\u003e","subscription_hold":"topic_is_announcement","todo_date":null,"is_announcement":true,"sort_order":"desc","sort_order_locked":false,"expanded":false,"expanded_locked":false},{"id":"2551000","title":"Guest lecture this Friday","last_reply_at":"2026-09-16T14:00:00Z","created_at":"2026-09-16T14:00:00Z","delayed_post_at":null,"posted_at":"2026-09-16T14:00:00Z","assignment_id":null,"root_topic_id":null,"position":null,"podcast_has_student_posts":false,"discussion_type":"side_comment","lock_at":null,"allow_rating":false,"only_graders_can_rate":false,"sort_by_rating":false,"is_section_specific":false,"anonymous_state":null,"summary_enabled":false,"user_name":"Morgan Fernhill","discussion_subentry_count":0,"permissions":{"attach":false,"update":false,"reply":false,"delete":false,"manage_assign_to":false},"require_initial_post":null,"user_can_see_posts":true,"podcast_url":null,"read_state":"read","unread_count":0,"subscribed":false,"attachments":[],"published":true,"can_unpublish":false,"locked":true,"can_lock":false,"comments_disabled":true,"author":{"id":"300111","anonymous_id":"6fkf","display_name":"Morgan Fernhill","avatar_image_url":"https://canvas.northfield.example/images/messages/avatar-50.png","html_url":"https://canvas.northfield.example/courses/51843/users/300111","pronouns":"she/her"},"html_url":"https://canvas.northfield.example/courses/51843/discussion_topics/2551000","url":"https://canvas.northfield.example/courses/51843/discussion_topics/2551000","pinned":false,"group_category_id":null,"can_group":true,"topic_children":[],"group_topic_children":[],"context_code":"course_51843","ungraded_discussion_overrides":[],"locked_for_user":false,"message":"\u003cp\u003eOur guest on Friday will talk about sleep and memory. Attendance counts toward participation.\u003c/p\u003e","subscription_hold":"topic_is_announcement","todo_date":null,"is_announcement":true,"sort_order":"desc","sort_order_locked":false,"expanded":false,"expanded_locked":false}]